Symbol,Name,Last Sale,Net Change,% Change,Market Cap,Country,IPO Year,Volume,Sector,Industry
PTMN,Portman Ridge Finance Corporation Common Stock,$18.81 ,-0.24,-1.26%,177699330,United States,2006,24082,Finance,Finance/Investors Services
PTON,Peloton Interactive Inc. Class A Common Stock,$4.02 ,-0.22,-5.19%,1474828471,United States,2019,19524330,Consumer Discretionary,Recreational Games/Products/Toys
PTPI,Petros Pharmaceuticals Inc. Common Stock,$1.12 ,0,0.00%,2465197,United States,,176960,Health Care,Biotechnology: Pharmaceutical Preparations
PTSI,P.A.M. Transportation Services Inc. Common Stock,$19.10 ,-1.18,-5.82%,420607613,United States,1986,14520,Industrials,Trucking Freight/Courier Services
PTVE,Pactiv Evergreen Inc. Common stock,$14.42 ,0,0.00%,2573329118,United States,2020,652611,Consumer Discretionary,Containers/Packaging
PTWO,Pono Capital Two Inc. Class A Common Stock,$10.95 ,0,0.00%,0,United States,2022,2747,Finance,Blank Checks
PTWOU,Pono Capital Two Inc. Unit,$10.95 ,0,0.00%,0,United States,2022,1,Finance,Blank Checks
PTWOW,Pono Capital Two Inc. Warrants,$0.04 ,-0.0237,-40.17%,0,United States,2022,69159,Finance,Blank Checks
PUBM,PubMatic Inc. Class A Common Stock,$14.81 ,-0.41,-2.69%,751787960,United States,2020,243752,Technology,Computer Software: Prepackaged Software
PUCK,Goal Acquisitions Corp. Common Stock,$10.71 ,-0.15,-1.38%,0,United States,2021,9995,Finance,Blank Checks
PUCKU,Goal Acquisitions Corp. Unit,$10.72 ,0,0.00%,0,United States,2021,2,Finance,Blank Checks
PUCKW,Goal Acquisitions Corp. Warrant,$0.02 ,-0.004,-21.05%,0,United States,2021,11630,Finance,Blank Checks
PULM,Pulmatrix Inc. Common Stock,$1.75 ,-0.03,-1.69%,6391499,United States,2014,8828,Health Care,Biotechnology: Pharmaceutical Preparations
PUYI,Puyi Inc. American Depository Shares,$6.30 ,0.05,0.80%,379982459,China,2019,3001,Finance,Investment Managers
PVBC,Provident Bancorp Inc. (MD) Common Stock,$10.18 ,-0.12,-1.17%,180001905,United States,2015,24069,Finance,Banks
PWFL,PowerFleet Inc. Common Stock,$3.16 ,-0.01,-0.32%,117590881,United States,,251593,Telecommunications,Telecommunications Equipment
PWM,Prestige Wealth Inc. Class A Ordinary Shares,$1.31 ,-0.14,-9.66%,11790000,Hong Kong,2023,40601,,
PWOD,Penns Woods Bancorp Inc. Common Stock,$20.24 ,-0.28,-1.37%,144990252,United States,,17812,Finance,Major Banks
PWP,Perella Weinberg Partners Class A Common Stock,$11.68 ,-0.06,-0.51%,1006215987,United States,2020,213191,Finance,Finance: Consumer Services
PWUP,PowerUp Acquisition Corp. Class A Ordinary Shares,$10.91 ,0,0.00%,0,United States,2022,153,Finance,Blank Checks
PWUPW,PowerUp Acquisition Corp. Warrant,$0.03 ,-0.0149,-37.25%,0,United States,2022,11846,Finance,Blank Checks
PXDT,Pixie Dust Technologies Inc. American Depositary Shares ,$7.89 ,0,0.00%,116000887,Japan,2023,1564,,
PXLW,Pixelworks Inc.  Common Stock,$2.04 ,0.01,0.49%,115654775,United States,2000,1102802,Technology,Semiconductors
PXMD,PaxMedica Inc. Common Stock,$0.44 ,-0.0361,-7.52%,1017736,United States,2022,112950,Health Care, Medicinal Chemicals and Botanical Products 
PXS,Pyxis Tankers Inc. Common Stock,$4.37 ,-0.09,-2.02%,46977500,Greece,,15087,Consumer Discretionary,Marine Transportation
PXSAP,Pyxis Tankers Inc. 7.75% Series A Cumulative Convertible Preferred Shares,$24.60 ,-0.1999,-0.81%,311296567,Greece,,1132,Consumer Discretionary,Marine Transportation
PXSAW,Pyxis Tankers Inc. Warrant,$1.45 ,0.1195,8.98%,18348781,Greece,,1440,Consumer Discretionary,Marine Transportation
PYCR,Paycor HCM Inc. Common Stock,$19.42 ,-0.75,-3.72%,3448776846,United States,2021,989857,Technology,Computer Software: Prepackaged Software
PYPD,PolyPid Ltd. Ordinary Shares,$6.74 ,-0.0971,-1.42%,10989449,Israel,2020,4936,Health Care,Medical/Dental Instruments
PYPL,PayPal Holdings Inc. Common Stock,$61.54 ,-0.88,-1.41%,66348749385,United States,,10186171,Consumer Discretionary,Business Services
PYXS,Pyxis Oncology Inc. Common Stock,$3.57 ,-0.11,-2.99%,158233274,United States,2021,337924,Health Care,Biotechnology: Pharmaceutical Preparations
PZZA,Papa John's International Inc. Common Stock,$72.01 ,-2.05,-2.77%,2358749335,United States,1993,845571,Consumer Discretionary,Restaurants
QCOM,QUALCOMM Incorporated Common Stock,$144.03 ,2.34,1.65%,1.60737E+11,United States,1991,8027212,Technology,Computer peripheral equipment
QCRH,QCR Holdings Inc. Common Stock,$56.46 ,-0.2,-0.35%,944710401,United States,,58286,Finance,Major Banks
QDEL,QuidelOrtho Corporation Common Stock,$67.81 ,-0.53,-0.78%,4530977268,United States,,510203,Health Care,Medical Specialities
QDRO,Quadro Acquisition One Corp. Class A Ordinary Shares,$10.97 ,0.01,0.09%,0,United States,2021,2986,Finance,Blank Checks
QDROU,Quadro Acquisition One Corp. Unit,$11.00 ,0.07,0.64%,0,United States,2021,500,Finance,Blank Checks
QDROW,Quadro Acquisition One Corp.  Warrant,$0.07 ,0.0196,39.12%,0,United States,2021,5352,Finance,Blank Checks
QETA,Quetta Acquisition Corporation Common Stock,$10.20 ,-0.05,-0.49%,0,United States,2023,30204,,
QETAR,Quetta Acquisition Corporation Right,$1.25 ,0.15,13.64%,0,United States,2023,100,,
QFIN,Qifu Technology Inc. American Depositary Shares,$13.78 ,-0.09,-0.65%,2224037321,China,2018,417451,Finance,Finance: Consumer Services
QH,Quhuo Limited American Depository Shares,$1.15 ,-0.03,-2.54%,7092764,China,2020,3759,Consumer Discretionary,Business Services
QIPT,Quipt Home Medical Corp. Common Shares,$4.63 ,-0.16,-3.34%,194934441,United States,,122641,,
QLGN,Qualigen Therapeutics Inc. Common Stock,$0.48 ,-0.0216,-4.31%,2487426,United States,2015,18305,Health Care,Biotechnology: Pharmaceutical Preparations
QLI,Qilian International Holding Group Ltd. Ordinary Shares,$0.59 ,0,0.00%,21164000,China,2021,4666,Health Care,Biotechnology: Pharmaceutical Preparations
QLYS,Qualys Inc. Common Stock,$168.24 ,-19.63,-10.45%,6188786463,United States,2012,1417324,Technology,EDP Services
QMCO,Quantum Corporation Common Stock,$0.38 ,-0.0093,-2.39%,36181959,United States,,92625,Technology,Electronic Components
QNCX,Quince Therapeutics Inc. Common Stock,$1.34 ,0.01,0.75%,57444389,United States,2019,55279,Health Care,Biotechnology: Biological Products (No Diagnostic Substances)
QNRX,Quoin Pharmaceuticals Ltd. American Depositary Shares,$3.46 ,0.16,4.85%,3415781,Israel,2016,16806,Health Care,Medical/Dental Instruments
QNST,QuinStreet Inc. Common Stock,$12.41 ,-0.26,-2.05%,677325936,United States,2010,216003,Consumer Discretionary,Advertising
QOMO,Qomolangma Acquisition Corp. Common Stock,$11.00 ,0,0.00%,0,United States,2022,60,Finance,Blank Checks
QOMOW,Qomolangma Acquisition Corp. Warrant,$0.02 ,0,0.00%,0,United States,2022,100,Finance,Blank Checks
QQQX,Nuveen NASDAQ 100 Dynamic Overwrite Fund Shares of Beneficial Interest,$23.21 ,0.01,0.04%,0,United States,,143985,Finance,Finance Companies
QRHC,Quest Resource Holding Corporation Common Stock,$6.51 ,-0.23,-3.41%,130590255,United States,,11518,Utilities,Environmental Services
QRTEA,Qurate Retail Inc. Series A Common Stock ,$0.80 ,-0.0501,-5.89%,311517936,United States,,2214730,Consumer Discretionary,Catalog/Specialty Distribution
QRTEB,Qurate Retail Inc. Series B Common Stock ,$5.22 ,-0.1,-1.88%,2032654532,United States,,1552,Consumer Discretionary,Catalog/Specialty Distribution
QRTEP,Qurate Retail Inc. 8.0% Fixed Rate Cumulative Redeemable Preferred Stock,$39.97 ,-0.18,-0.45%,15564214877,United States,,21123,Consumer Discretionary,Catalog/Specialty Distribution
QRVO,Qorvo Inc. Common Stock,$107.33 ,3.74,3.61%,10362545997,United States,,1736408,Technology,Semiconductors
QSG,QuantaSing Group Limited American Depositary Shares,$3.84 ,-0.08,-2.04%,211991624,China,2023,98045,Real Estate,Other Consumer Services
QSI,Quantum-Si Incorporated Class A Common Stock,$1.49 ,-0.03,-1.97%,211174771,United States,2020,442827,Health Care,Biotechnology: Pharmaceutical Preparations
QSIAW,Quantum-Si Incorporated Warrant,$0.12 ,-0.0117,-8.67%,17460894,United States,2020,1678,Health Care,Biotechnology: Pharmaceutical Preparations
QTRX,Quanterix Corporation Common Stock,$23.44 ,0.34,1.47%,886729246,United States,2017,258623,Industrials,Biotechnology: Laboratory Analytical Instruments
QUBT,Quantum Computing Inc. Common Stock,$0.76 ,-0.0284,-3.60%,57194065,United States,,815281,Technology,Computer Manufacturing
QUIK,QuickLogic Corporation Common Stock,$11.61 ,0.2,1.75%,161496574,United States,1999,128645,Technology,Semiconductors
QURE,uniQure N.V. Ordinary Shares,$5.42 ,0.03,0.56%,259138216,Netherlands,2014,716770,Health Care,Biotechnology: Pharmaceutical Preparations
RAIL,FreightCar America Inc. Common Stock,$2.72 ,-0.095,-3.38%,48697349,United States,2005,18930,Industrials,Railroads
RAND,Rand Capital Corporation Common Stock,$13.42 ,-0.0339,-0.25%,34624397,United States,,370,Finance,Finance: Consumer Services
RANI,Rani Therapeutics Holdings Inc. Class A Common Stock,$3.69 ,0.2,5.73%,184487115,United States,2021,180779,Health Care, Medicinal Chemicals and Botanical Products 
RAPT,RAPT Therapeutics Inc. Common Stock,$25.10 ,0.18,0.72%,863344921,United States,2019,463568,Health Care,Biotechnology: Pharmaceutical Preparations
RARE,Ultragenyx Pharmaceutical Inc. Common Stock,$44.76 ,1.74,4.05%,3675438306,United States,2014,710096,Health Care,Biotechnology: Pharmaceutical Preparations
RAVE,Rave Restaurant Group Inc. Common Stock,$1.94 ,-0.04,-2.02%,28297938,United States,,9232,Consumer Discretionary,Food Distributors
RAYA,Erayak Power Solution Group Inc. Class A Ordinary Shares,$0.80 ,-0.0047,-0.58%,9960000,China,2022,11076,Consumer Discretionary,Metal Fabrications
RBB,RBB Bancorp Common Stock,$17.27 ,-0.35,-1.99%,328048883,United States,2017,26130,Finance,Major Banks
RBBN,Ribbon Communications Inc. Common Stock,$3.21 ,0.11,3.55%,551255730,United States,,425787,Technology,EDP Services
RBCAA,Republic Bancorp Inc. Class A Common Stock,$50.05 ,-0.5,-0.99%,969899681,United States,1998,16307,Finance,Major Banks
RBKB,Rhinebeck Bancorp Inc. Common Stock,$8.85 ,0,0.00%,97992572,United States,2019,33574,Finance,Banks
RCAC,Revelstone Capital Acquisition Corp. Class A Common Stock,$10.71 ,0,0.00%,0,United States,2022,135,Finance,Blank Checks
RCACU,Revelstone Capital Acquisition Corp. Unit,$10.49 ,0,0.00%,0,United States,2021,1,Finance,Blank Checks
RCAT,Red Cat Holdings Inc. Common Stock,$0.60 ,-0.0463,-7.14%,44645918,United States,,191474,Industrials,Wholesale Distributors
RCEL,Avita Medical Inc. Common Stock,$16.71 ,-0.19,-1.12%,426952097,United States,,110658,Health Care,Medical/Dental Instruments
RCKT,Rocket Pharmaceuticals Inc. Common Stock,$28.64 ,0.09,0.32%,2582150753,United States,2015,671864,Health Care,Biotechnology: Pharmaceutical Preparations
RCKTW,Rocket Pharmaceuticals Inc. Warrant,$0.25 ,0,0.00%,,United States,,50,Health Care,Biotechnology: Pharmaceutical Preparations
RCKY,Rocky Brands Inc. Common Stock,$27.08 ,-1.37,-4.82%,199791609,United States,1993,27673,Consumer Discretionary,Shoe Manufacturing
RCM,R1 RCM Inc. Common Stock,$10.51 ,-0.28,-2.60%,4406928720,United States,,2954010,Consumer Discretionary,Other Consumer Services
RCMT,RCM Technologies Inc. Common Stock,$26.97 ,-0.14,-0.52%,211239639,United States,,77027,Consumer Discretionary,Professional Services
RCON,Recon Technology Ltd. Class A Ordinary Shares,$0.17 ,-0.0019,-1.11%,6877639,China,2009,64954,Energy,Oilfield Services/Equipment
RCRT,Recruiter.com Group Inc. Common Stock,$1.37 ,0.19,16.10%,1964447,United States,,38545,Technology,EDP Services
RCRTW,Recruiter.com Group Inc. Warrant,$0.01 ,0.0074,148.00%,17780,United States,,23935,Technology,EDP Services
RDCM,Radcom Ltd. Ordinary Shares,$9.86 ,-0.17,-1.70%,147801400,Israel,1997,35562,Technology,Computer peripheral equipment
RDFN,Redfin Corporation Common Stock,$8.08 ,-0.38,-4.49%,931152435,United States,2017,4446692,Finance,Real Estate
RDHL,Redhill Biopharma Ltd. American Depositary Shares,$0.53 ,-0.0401,-7.04%,15739634,Israel,,952298,Health Care,Biotechnology: Pharmaceutical Preparations
RDI,Reading International Inc Class A Common Stock,$1.89 ,-0.105,-5.26%,38920456,United States,,22683,Consumer Discretionary,Movies/Entertainment
RDIB,Reading International Inc Class B Common Stock,$13.79 ,0.14,1.03%,23175336,United States,,1964,Consumer Discretionary,Movies/Entertainment
RDNT,RadNet Inc. Common Stock,$37.15 ,-0.51,-1.35%,2522288291,United States,,209227,Health Care,Medical Specialities
RDUS,Schnitzer Steel Industries Inc. Class A Common Stock,$24.57 ,-0.73,-2.89%,684561600,United States,,136873,Consumer Discretionary,Industrial Specialties
RDVT,Red Violet Inc. Common Stock ,$17.70 ,-0.84,-4.53%,246727469,United States,,33389,Technology,Computer Software: Prepackaged Software
RDWR,Radware Ltd. Ordinary Shares,$18.34 ,-0.42,-2.24%,803656966,Israel,1999,97762,Consumer Discretionary,Business Services
RDZN,Roadzen Inc. Ordinary Shares,$6.75 ,-0.42,-5.86%,461975596,United States,2022,14881,Finance,Blank Checks
RDZNW,Roadzen Inc. Warrants,$0.11 ,0.0215,23.24%,7802255,United States,2022,43540,Finance,Blank Checks
REAL,The RealReal Inc. Common Stock,$1.81 ,-0.02,-1.09%,187069140,United States,2019,1005194,Consumer Discretionary,Consumer Specialties
REAX,The Real Brokerage Inc. Common Shares,$2.88 ,-0.02,-0.69%,523584000,Canada,,241224,Finance,Real Estate
REBN,Reborn Coffee Inc. Common Stock,$3.85 ,-0.2443,-5.97%,10381690,United States,2022,335904,Consumer Discretionary,Restaurants
REE,REE Automotive Ltd. Class A Ordinary Shares,$6.00 ,-0.27,-4.31%,66953910,Israel,,48545,Consumer Discretionary,Auto Manufacturing
REFI,Chicago Atlantic Real Estate Finance Inc. Common Stock,$15.73 ,-0.15,-0.95%,286006651,United States,2021,58645,Real Estate,Real Estate Investment Trusts
REFR,Research Frontiers Incorporated Common Stock,$1.03 ,-0.01,-0.96%,34514566,United States,,16825,Technology,Industrial Machinery/Components
REG,Regency Centers Corporation Common Stock,$61.23 ,-1.37,-2.19%,11301893467,United States,1993,1179447,Real Estate,Real Estate Investment Trusts
REGCO,Regency Centers Corporation 5.875% Series B Cumulative Redeemable Preferred Stock,$24.52 ,0,0.00%,0,United States,,465,,
REGCP,Regency Centers Corporation 6.25% Series A Cumulative Redeemable Preferred Stock,$24.96 ,-0.12,-0.48%,0,United States,,254,,
REGN,Regeneron Pharmaceuticals Inc. Common Stock,$936.33 ,-8.85,-0.94%,1.0201E+11,United States,1991,703769,Health Care,Biotechnology: Pharmaceutical Preparations
REKR,Rekor Systems Inc. Common Stock,$3.05 ,-0.07,-2.24%,210898634,United States,,828558,Telecommunications,Telecommunications Equipment
RELI,Reliance Global Group Inc. Common Stock,$0.46 ,0.0072,1.60%,2180324,United States,,17863,Finance,Specialty Insurers
RELL,Richardson Electronics Ltd. Common Stock,$9.36 ,-0.25,-2.60%,133646208,United States,1983,162650,Technology,Electronic Components
RELY,Remitly Global Inc. Common Stock,$18.09 ,0.24,1.35%,3349503535,United States,2021,1234901,Technology,Computer Software: Prepackaged Software
RENB,Renovaro Biosciences Inc. Common Stock,$4.34 ,-0.05,-1.14%,289469945,United States,,271272,Health Care,Biotechnology: Pharmaceutical Preparations
RENE,Cartesian Growth Corporation II Class A Ordinary Shares,$11.04 ,0.01,0.09%,0,United States,2022,3970,Finance,Blank Checks
RENEU,Cartesian Growth Corporation II Unit,$11.03 ,-0.02,-0.18%,0,United States,2022,153,Finance,Blank Checks
RENT,Rent the Runway Inc. Class A Common Stock,$0.51 ,-0.0201,-3.83%,35512446,United States,2021,1628514,Consumer Discretionary,Other Specialty Stores
REPL,Replimune Group Inc. Common Stock,$7.05 ,-0.29,-3.95%,416368368,United States,2018,1779188,Health Care,Biotechnology: Pharmaceutical Preparations
RETO,ReTo Eco-Solutions Inc. Common Shares,$0.33 ,-0.027,-7.67%,1748500,China,2017,75408,Industrials,Industrial Machinery/Components
REVB,Revelation Biosciences Inc. Common Stock,$3.20 ,0.155,5.09%,671715,United States,2020,688954,Health Care,Biotechnology: Pharmaceutical Preparations
REVBW,Revelation Biosciences Inc. Warrant,$0.01 ,-0.0006,-7.69%,1511,United States,2020,55009,Health Care,Biotechnology: Pharmaceutical Preparations
REYN,Reynolds Consumer Products Inc. Common Stock,$27.75 ,0,0.00%,5827756160,United States,2020,446810,Industrials,Office Equipment/Supplies/Services
RFACR,RF Acquisition Corp. Rights,$0.07 ,-0.01,-12.50%,0,Singapore,2022,66600,Finance,Blank Checks
RFACW,RF Acquisition Corp. Warrants,$0.01 ,-0.0013,-8.67%,0,Singapore,2022,13202,Finance,Blank Checks
RFIL,RF Industries Ltd. Common Stock,$3.19 ,-0.04,-1.24%,32994881,United States,,2279,Technology,Electrical Products
RGC,Regencell Bioscience Holdings Limited Ordinary Shares,$8.01 ,0.11,1.39%,104233057,Hong Kong,2021,126,Health Care, Medicinal Chemicals and Botanical Products 
RGCO,RGC Resources Inc. Common Stock,$18.08 ,-0.83,-4.39%,181374257,United States,,23169,Utilities,Oil & Gas Production
RGEN,Repligen Corporation Common Stock,$196.10 ,-0.07,-0.04%,10948657749,United States,1986,298492,Health Care,Biotechnology: Biological Products (No Diagnostic Substances)
RGF,The Real Good Food Company Inc. Class A Common Stock,$1.12 ,-0.06,-5.09%,37726308,United States,2021,95458,Consumer Staples,Packaged Foods
RGLD,Royal Gold Inc. Common Stock,$111.78 ,-2.21,-1.94%,7343053101,United States,,230394,Industrials,Precious Metals
RGLS,Regulus Therapeutics Inc. Common Stock,$1.34 ,-0.01,-0.74%,27098380,United States,2012,29504,Health Care,Biotechnology: Pharmaceutical Preparations
RGNX,REGENXBIO Inc. Common Stock,$12.32 ,0.08,0.65%,541981194,United States,2015,407439,Health Care,Biotechnology: Biological Products (No Diagnostic Substances)
RGP,Resources Connection Inc. Common Stock,$13.25 ,-0.07,-0.53%,443983716,United States,,221341,Consumer Discretionary,Business Services
RGS,Regis Corporation Common Stock,$12.89 ,0.39,3.12%,29382111,United States,1991,17240,Consumer Discretionary,Other Consumer Services
RGTI,Rigetti Computing Inc. Common Stock,$1.18 ,-0.09,-7.09%,0,United States,,4138841,Technology,Retail: Computer Software & Peripheral Equipment
RGTIW,Rigetti Computing Inc. Warrants,$0.22 ,-0.0621,-22.18%,0,United States,,21041,Technology,Retail: Computer Software & Peripheral Equipment
RICK,RCI Hospitality Holdings Inc. Common Stock,$60.23 ,-2.14,-3.43%,563733828,United States,1995,73859,Consumer Discretionary,Restaurants
RIGL,Rigel Pharmaceuticals Inc. Common Stock,$1.17 ,0.03,2.63%,204012319,United States,2000,981672,Health Care,Biotechnology: Pharmaceutical Preparations
RILY,B. Riley Financial Inc. Common Stock,$18.79 ,-1.5,-7.39%,574652146,United States,,954608,Finance,Investment Managers
RILYG,B. Riley Financial Inc. 5.00% Senior Notes due 2026,$15.52 ,0.05,0.32%,474646158,United States,,22185,Finance,Investment Managers
RILYK,B. Riley Financial Inc. 5.50% Senior Notes Due 2026,$18.58 ,-0.14,-0.75%,568229743,United States,,11428,Finance,Investment Managers
RILYL,B. Riley Financial Inc. Depositary Shares each representing 1/1000th in a share of 7.375% Series B Cumulative Perpetual Preferred Stock par value $0.0001,$21.03 ,0.5783,2.83%,643105786,United States,,8368,Finance,Investment Managers
RILYM,B. Riley Financial Inc. 6.375% Senior Notes due 2025,$21.48 ,-0.15,-0.69%,656920069,United States,,25691,Finance,Investment Managers
RILYN,B. Riley Financial Inc. 6.50% Senior Notes Due 2026,$17.01 ,-0.29,-1.68%,520214636,United States,,20719,Finance,Investment Managers
RILYO,B. Riley Financial Inc. 6.75% Senior Notes due 2024,$24.86 ,0.03,0.12%,760290173,United States,,23169,Finance,Investment Managers
RILYP,B. Riley Financial Inc. Depositary Shares each representing a 1/1000th fractional interest in a share of Series A Cumulative Perpetual Preferred Stock,$18.00 ,0.45,2.56%,550491678,United States,,1948,Finance,Investment Managers
RILYT,B. Riley Financial Inc. 6.00% Senior Notes Due 2028,$15.45 ,0.06,0.39%,472505357,United States,,25260,Finance,Investment Managers
RILYZ,B. Riley Financial Inc. 5.25% Senior Notes due 2028,$13.44 ,-0.04,-0.30%,411033786,United States,,49761,Finance,Investment Managers
RIOT,Riot Platforms Inc. Common Stock ,$10.34 ,-0.87,-7.76%,2135369391,United States,,16206094,Finance,Finance: Consumer Services
RIVN,Rivian Automotive Inc. Class A Common Stock,$14.94 ,-0.66,-4.23%,14308300824,United States,2021,29463769,Consumer Discretionary,Auto Manufacturing
RKDA,Arcadia Biosciences Inc. Common Stock,$2.39 ,-0.1499,-5.90%,2653705,United States,2015,10858,Industrials,Agricultural Chemicals
RKLB,Rocket Lab USA Inc. Common Stock,$4.07 ,0.095,2.39%,1977560062,United States,2020,11173473,Industrials,Aerospace
RLAY,Relay Therapeutics Inc. Common Stock,$8.69 ,-0.31,-3.44%,1071205351,United States,2020,981901,Health Care,Biotechnology: Biological Products (No Diagnostic Substances)
RLMD,Relmada Therapeutics Inc. Common Stock,$5.04 ,0.44,9.57%,151699983,United States,,724694,Health Care,Biotechnology: Pharmaceutical Preparations
RLYB,Rallybio Corporation Common Stock,$1.25 ,-0.06,-4.58%,47242131,United States,2021,273831,Health Care,Biotechnology: Pharmaceutical Preparations
RMBI,Richmond Mutual Bancorporation Inc. Common Stock,$11.17 ,-0.24,-2.10%,125602953,United States,2019,4756,Finance,Major Banks
RMBL,RumbleOn Inc. Class B Common Stock,$6.47 ,-0.36,-5.27%,109079665,United States,,133403,Technology,EDP Services
RMBS,Rambus Inc. Common Stock,$68.37 ,-0.48,-0.70%,7350406807,United States,1997,2492595,Technology,Semiconductors
RMCF,Rocky Mountain Chocolate Factory Inc. Common Stock,$4.01 ,-0.09,-2.20%,25324189,United States,,10063,Consumer Staples,Specialty Foods
RMCO,Royalty Management Holding Corporation Class A Common Stock,$1.64 ,0.2901,21.49%,0,United States,2023,93058,Miscellaneous,Multi-Sector Companies
RMCOW,Royalty Management Holding Corporation Warrant,$0.06 ,0.0367,166.06%,0,United States,2023,120490,Miscellaneous,Multi-Sector Companies
RMGC,RMG Acquisition Corp. III Class A Ordinary Shares,$10.10 ,-0.07,-0.69%,0,United States,2021,4439,Finance,Blank Checks
RMGCW,RMG Acquisition Corp. III Warrant,$0.07 ,0.0001,0.15%,0,United States,2021,16133,Finance,Blank Checks
RMNI,Rimini Street Inc. (DE) Common Stock,$3.19 ,-0.08,-2.45%,285150910,United States,2015,209529,Consumer Discretionary,Business Services
RMR,The RMR Group Inc. Class A Common Stock,$24.85 ,-0.87,-3.38%,788019518,United States,,60156,Finance,Real Estate
RMTI,Rockwell Medical Inc. Common Stock,$1.25 ,-0.05,-3.85%,35612079,United States,1998,197071,Health Care,Biotechnology: Pharmaceutical Preparations
RNA,Avidity Biosciences Inc. Common Stock,$11.64 ,0.01,0.09%,862538597,United States,2020,590014,Health Care,Biotechnology: Pharmaceutical Preparations
RNAC,Cartesian Therapeutics Inc. Common Stock,$0.64 ,-0.065,-9.18%,99765248,United States,2016,585913,Health Care,Biotechnology: Pharmaceutical Preparations
RNAZ,TransCode Therapeutics Inc. Common Stock,$0.58 ,-0.0617,-9.68%,361280,United States,2021,805223,Health Care,Biotechnology: Pharmaceutical Preparations
RNLX,Renalytix plc American Depositary Shares,$0.28 ,-0.0283,-9.06%,13839954,United Kingdom,2020,110471,Health Care,Medical Specialities
RNW,ReNew Energy Global plc Class A Ordinary Shares,$6.24 ,-0.2,-3.11%,502373789,United Kingdom,,398465,Utilities,Electric Utilities: Central
RNWWW,ReNew Energy Global plc Warrant,$0.71 ,-0.1329,-15.82%,56927645,United Kingdom,,152,Utilities,Electric Utilities: Central
RNXT,RenovoRx Inc. Common Stock,$1.66 ,-0.04,-2.35%,17751343,United States,2021,46059,Health Care,Biotechnology: Pharmaceutical Preparations
ROAD,Construction Partners Inc. Class A Common Stock,$47.27 ,-1.49,-3.06%,2497149591,United States,2018,291099,Industrials,Military/Government/Technical
ROCK,Gibraltar Industries Inc. Common Stock,$83.08 ,-0.85,-1.01%,2528659269,United States,1993,145233,Industrials,Steel/Iron Ore
ROCL,Roth CH Acquisition V Co. Common Stock,$10.83 ,0.02,0.19%,0,United States,2022,3443,Finance,Blank Checks
ROCLU,Roth CH Acquisition V Co. Unit,$10.90 ,0.28,2.64%,0,United States,2021,300,Finance,Blank Checks
ROCLW,Roth CH Acquisition V Co. Warrant,$0.07 ,-0.0075,-9.68%,0,United States,2022,26689,Finance,Blank Checks
ROI,RiskOn International Inc. Common Stock,$0.11 ,-0.001,-0.94%,373301,United States,,1784653,Energy,Oil & Gas Production
ROIC,Retail Opportunity Investments Corp. Common Stock (MD),$13.56 ,-0.19,-1.38%,1708584340,United States,,1153189,Real Estate,Real Estate Investment Trusts
ROIV,Roivant Sciences Ltd. Common Shares,$10.02 ,0.13,1.31%,8055291987,United Kingdom,,3770765,Health Care,Biotechnology: Pharmaceutical Preparations
ROKU,Roku Inc. Class A Common Stock,$87.75 ,-3.28,-3.60%,12504009258,United States,2017,4347808,Telecommunications,Cable & Other Pay Television Services
ROMA,Roma Green Finance Limited Ordinary Shares,$0.80 ,-0.1011,-11.17%,8381933,Hong Kong,2024,1512915,Finance,Savings Institutions
ROOT,Root Inc. Class A Common Stock,$7.63 ,-0.44,-5.45%,111398000,United States,2020,81090,Finance,Property-Casualty Insurers
ROP,Roper Technologies Inc. Common Stock,$545.89 ,-3.73,-0.68%,58313125449,United States,1992,335573,Industrials,Industrial Machinery/Components
ROST,Ross Stores Inc. Common Stock,$142.75 ,-0.93,-0.65%,48059109472,United States,1985,2879303,Consumer Discretionary,Clothing/Shoe/Accessory Stores
ROVR,Rover Group Inc. Class A Common Stock,$10.95 ,0,0.00%,1964781681,United States,2021,1284039,Consumer Discretionary,Other Consumer Services
RPAY,Repay Holdings Corporation Class A Common Stock,$7.99 ,-0.08,-0.99%,756325250,United States,2018,932547,Consumer Discretionary,Business Services
RPD,Rapid7 Inc. Common Stock,$55.43 ,-1.36,-2.40%,3406005713,United States,2015,948024,Technology,Computer Software: Prepackaged Software
RPHM,Reneo Pharmaceuticals Inc. Common Stock,$1.64 ,0.05,3.15%,54631331,United States,2021,437240,Health Care,Biotechnology: Pharmaceutical Preparations
